ID,Story,RaterMean
66,"He gazed at the picture the same way he did everyday he passed it.  The one that got away, the love of his life.  He's been keeping tabs on her from afar, checking in with her friends to see if she's single, etc.  He finally found out she's available, this is his chance.  He had so much to say to her, it was his fault she didn't know how he felt the first time.  He took out a stamp, paper, pen, and envelop and poured out his heart.  He took the letter and put it in the mail to send.  He can only wait to see how she took it.",4.25
67,"The girl anxiously awaited the postman.  It had been two weeks since the last letter from her penpal.  It isn't common these days to have a penpal, but the young child loved receiving mail.  He had arrived! She eagerly thumbed through the mail, checking the postmarks on the stamps.  Finally, it was here! She was hoping to send her letter after reading it.  It was all she had hoped for.",3
68,"I decided recently to write my kids each a letter.  I started with my younger daughter, since I had recently visited her.  I got the letter written, but then I couldn't find a stamp to send it!  I searched high and low, and finally found a stamp in a seldom used drawer.  I got the letter sent, and started on the next letter.",2
69,"I moved to a new state the other day. I had to change my address with the post office. I filled out the application, placed it in an envelope, and added a letter for clarification. Then I put a first-class stamp on the top left corner. I made sure to send it in person.",2
70,"My son wanted to send a letter to a friend from school who recently went overseas. He is only 7 years old so I sat down with him to help organize his thoughts and properly write a letter filled with love. I asked about what things he likes about the friend, but he simply said, ""Nothing really."" After that, I just had him write anything and let him pick the stamp to send the letter with.",3
71,"Jen didn't know what to do. Write that letter, open her heart to Jack, and risk a rejection, or maybe start a beautiful path together? Was her love corresponded? She thought for days about it, the letter already written, and at some point she just decided to take that jump, and to send that damn/blessed letter. She went to the postal office, bought a stamp, and after kissing the letter goodbye, she gave it to the employee, whose sympathetic smile gave her some hope that things might have turned well.",4
72,When people send something in the mail they don't think about the magical journey it will go on. A simple letter with a stamp can travel across the earth. A letter can go from continent to continent. It travels across the sea by plane or ship. Letters go on quite the adventure.,3
73,"It was a dark and stormy night. There was only one thing on the man's mind: to send a letter that was enclosed with a check for his bills. However, there was a problem. He needed to get a stamp for the letter! He went to a nearby store and got the only stamps they had left, which was a stamp featuring a cute doggie on it. On his way to the nearby mail drop box, his car ran out of gas and his quest was never completed.",3.5
74,"I wanted to send a message to the crazy expectations that one of the people in my office have.  They had been pushing the envelope for months in hopes of getting a big raise, large bonus and a promotion.  He thought because he uncle worked for the company everything would be handed to him on a silver platter.  His attitude had become too much and I was going to stop it in its tracks.  Not only did he not get a raise, promotion or bonus - I put a formal letter of complaint in his file.",3.75
75,A person sent a letter to his wife. He was eagerly expecting a reply from her. But the letter returned as there was no stamp in it. He became depressed about the incident and sent the letter again with a stamp on it.,2.25
76,He searched the drawer for a stamp. Nothing. There wasn't one there. He had an important letter in his hand practically naked. He needed to put it in the mailbox before the mail carrier arrived. Where was that stamp?,2
77,"it's been weeks. my search never seems to succeed. I fret each time I think about it. the situation is comical, yet critical. you see, 6 months ago, the world stopped producing stamps permanently. and I know, for certain, that I held the last stamp in the world, lost amongst my belongings. the need to send the last letter to the other last person on earth never stops eating at me. it begs the question: why do I need a stamp anyways?",4.75
78,"We held a meeting on how we can get the proposal stamped, i was given the letter to draft and send to the headquarter for approval.",1.75
79,"Jimmy was excited for Christmas. It was only the start of November, but he already knew what he wanted to write in his letter to Santa.   He decided with the mail being slow in 2020, it might be better to send the letter now.  So, he carefully wrote down everything he wanted, pointed out how good was at wearing his mask this year and put a stamp on the letter.  Now the real waiting starts.",3.75
80,"The mail man received the letter and noticed something was missing. He handed it back and explained how a newer version of the stamps are required. Without this, it cannot be send and it will be lost in transit. The person decided to buy more stamps on the spot.",2.25
81,"""Send it, send it! You must expose the lies!"" I stall, unsure of what to do, as I clutch the letter between my fingers. The information would not only ruin the mayor but demoralize our people. I put it up to my eyes, and I see our official seal on the fresh stamp. But I simply cannot do it-- I cast the letter into the fire, preventing a single soul to bear witness to what we just exposed.",4.5
82,Derek placed the stamp on the letter and set it on the table. He took two steps back and contemplated what it would mean to send this letter. The information inside was scandalous to be sure but had the potential to improve many lives. He once again found himself contemplating the ramifications of exposing this information. He picked up the letter and headed to the post box. Let the walls come crashing down. He was ready for the shakeup.,3.75
83,I spent an hour writing a letter to my sister. I'm going to send it to her when I go out later. First I need to get a stamp from the post office. I hope they're open late because I have a lot to do today. I'm waiting for it to stop raining before I leave home.,2
84,"I need to mail an important letter to my friend overseas. She asks about me often but I want to go the old school route and send it by postal. All I need to do is put a stamp on it and then deliver it to the post office. Hopefully, it gets to her in time.",1.75
85,"Josie took the letter, sealed it with a kiss on the rear, and placed it into the envelope. Never before had she predicted that she would fall in love like this. Over the days and months she found herself falling for this new penpal. What would her parents say if they knew she had fallen for someone serving a life sentence? Pushing the thought out of her mind, she closed the letter, affixed the stamp, and headed out the door to send it to her lover.",4.25
86,Angela was missing her grandmother. Her grandmother had lost her hearing so she was unable to call her. She decided to send her grandmother a letter. The letter would tell her how much she missed her and would fill her in on what was going on in her life. When the letter was finished Angela put a stamp on the envelop and put in,2.75
87,I love travelling so every time I travel I SEND some LETTER  with special STAMP to home. One of the mistakes i did was to not SEND a soecuak i,1.666666667
88,"A week ago, I wrote a letter to my uncle. I wish to send it by post. I pasted a stamp on the envelope. But the person who was in the office told me that the stamp I pasted was not appropriate for the given address. Then I pasted another stamp which was allocated to that address.",1.75
89,Who puts stamps on letters anymore? That is so old-school. I prefer to send my letter without anything in the corners. I just send them out and hope for the best.,1.75
90,"last week i was went to the post office for send the courier for my friend who was live in the California,  i was post the mail with the courier and i was forget the stamp and with the letter for my friend .i was send that with letter for my friend and make my day which was completely.",1.5
91,"Joe got out his pen and paper and began to write a letter to his friend in another kingdom. He asked about what was happening to his friend and to the country, and if the Princess had been found yet. Once he finished writing, he sealed the letter in an envelope and placed a stamp on it. Joe then proceeded to the post office to send the letter.",2.5
92,"I had received an invitation to the Queen's ball, and was so excited to send my acceptance reply in the mail. I had the letter in hand, and was getting in my car to go to the post office. Of all things the car wouldn't start! I was in a panic! I had to get a stamp on my reply and put it in the mail today or I would miss the ASAP response deadline. Nothing to do but call Uber, put on a mask, and suck it up in an enclosed car. Risking COVID to go to a ball in a small price to pay to hob nob with royalty.",4.5
93,"My Grandparents that lived in Maryland don't really use technology at all. We usually would have to send them a letter if we wanted to talk to them long distance. I once sent them a letter but almost forgot the stamp, but my Mother reminded me at the last second. They usually write back to us in a week or two. It might not be as effective as texting, but it does the job.",2.75
94,"The person went to a office to get a stamp.  The person was surprised that he/she/it/robot/etc wasn't charged for the stamps.  The person then went home and wrote a letter to send to his friend.  The person wanted to send it to his friend within three days of writing it, as the content within was important, but the person had no other way to communicate with that person.",1.5
95,Sam was thrilled that the letter had finally arrived. As she stood in front of her mailbox she ran her fingers over the cancelled stamp from California. She wanted to savor this moment for as long as she could. She was told to send her application in early to avoid being put on a waiting list. As she closed her eyes she thought about what sorts of adventures were going to begin once she opened the envelope.,3.75
96,"If you want to send a person a letter like the old days, it may seem a little odd.  You will need to write the letter and place it in an envelope.  Then, you will need to have a postage stamp to place on the envelope in order to send it.  This is an archaic process, and you may be better off sending an email.  Unless, you are sending them something tangible.",2
97,"I gently folded the letter and slipped it into the envelope. I hoped it would reach him in time. Placing a stamp on the envelope, I slipped it into my bag. I would place it in the mail on my way to work. I hoped he would receive it in good humor, and send the funds I requested before the bank took the house.",2.5
98,The boy was ready to send his first letter in the mail. He had just been taught how to write and send a letter in school. He decided to send a letter to Santa with a list of the toys he wanted from Christmas. He asked his father for a stamp to but in the letter. He licked the stamp wrote the address of the North Pole and put the letter in the mailbox. The boy hoped the letter would get to Santa safely.,2.75
99,I had a friend that lived in Europe who I hadn't communicated with for years. I didn't have a phone and they didn't own a computer so the only way I can communicate with them was by sending or writing them a letter. So I decided I would send them a letter reminding them that I was still a friend. Because the letter was being mailed to Europe it would take more than one stamp. I purchased all of the stamps that I needed and put them on the letter and mailed it out to my friend.,2.5
100,"I had to send an important letter to the mayor of the town. His life was in danger and I was the only one who could save him. I quickly reached for an envelope, I stamped the letter and then sent it to the mailman. The stamp was coded with a message and language only we knew how to decipher.",3.75
101,I used the stamp to send the letter. The stamp was of the value I needed. I will send the letter tomorrow. The post office will be open on-time,1.25
102,"Ms. Jackson sealed the letter in an envelope, placed a stamp on the upper left corner and prepared to send it to her ex-lover, now living halfway around the world. John was his name. He was living in Columbia, working in the drug trade. Word was he was a king pin now. John preferred Ms. Jackson communicated with him through mail, rather than electronically. They were less traceable this way.",4
103,"I needed to send in my tax letter for for the year, but had no stamp. So, off I go to the post office, where I had to wait in line. Of course, I had to stay 6 feet away from the next person in line, and several times I had people step in front of me. I was patient, though, and didn't make a fuss. They were obviously in more of a hurry than I.",2.25
104,The children were playing in the back yard when they discovered a box buried under the bench by the tree. When they opened the box they saw an old letter. There was a stamp on the envelope but it was never delivered. The wanted to open the letter but were afraid of what it might contain. One of the kids suggested they just send the letter in the mail since it had a stamp on it. The children decided to give the letter to their parents and let them decide what to do with it.,4.75
105,"In our childhood days, my mother used to send letter with stamp to our relatives in other countries and state. It was an good time to write our thoughts and feelings in the letter. When there was very limited telephone communication we used to send letter to our beloved ones.We were happy and fun to send letters.We used to buy  letter card with stamp fix in it.",2.25
106,"Lilah is sending her grandmother a letter in the mail for the first time. She has never sent mail to another person so her mother is teaching her today. She explained the steps very carefully. First, Lilah needs to write her letter. Second, she needs to put her letter in an envelope. Third, she needs to fill out the address that her grandmother lives at. Fourth, she needs to put a stamp in the right hand corner. Fifth, she needs to put it in the mailbox to send it off.",2.5
107,"Today, I went to the post office because I needed to buy a stamp. I have a friend who lives in Thailand who I wrote a long letter to. I want to send it as soon as I can because it takes much longer for mail to get there than if she lived in North America. I met this friend on a trip that I took to Asia many years ago and we always kept in touch. However, even with smartphones and access to email, we always have sent physical letters to one another. It is a touching tradition that we keep.",3.25
108,I love being old-fashioned about some things.  And writing a letter is one of those things.  I love the feeling of putting on a stamp and putting something in the mailbox.  So much more satisfying than typing and hitting the send button.,1.75
109,Olden days I communicate with my parents by writing letters and stamp them and send them to the post office. Those days were really a,1.333333333
110,"A little boy decided one week before Christmas he was going to send a letter to Santa Claus describing all the wonderful things he wanted that year. So he went to his mother and asked her for a pencil, paper, and an envelope so that he could craft this wonderful letter to send to Santa. After he was finishing drawing and coloring his letter he asked his mother for a stamp so that he could put it in the mail box. After getting the stamp and putting the letter in the mailbox he waited patiently staring out the window for the mailman to come get it. It was Saturday so he ended up waiting almost two whole days before the postman finally picked up the letter on Monday morning. The little boy was so ecstatic that his letter had finally been sent off and it'd be going to Santa Claus. Christmas came and he got everything he asked for in his letter, he was a lucky little boy.",3
111,"It was time to cast ballets and Dan was ready to vote. This was the first year he was eligible to vote and he was ready. He filled out the ballet on letter sized paper and put it into an envelope. He sealed the envelope, making sure to include a stamp. He was now ready to send the letter.",2.25
112,"It was her grandson's birthday in a few days. He lived across the country and she wanted to send him a letter with some money for his birthday. She got the letter and money all prepared, all she needed now was a stamp. She could have sworn that she had one in the drawer, but she was unable to find one. On her next stop into town she finally bought a book of stamps and sent the letter, it was a few days late, but the grandson called her to thank her anyways.",3
113,In my office I am the letter collector and also it is my responsible to send and stamp the the letter. One day i forget to send letter on time so my boss reduce my salary and then  I realize that and send the letter very proper way and then my boss offer me to do more works on the send the letter.,3.25
114,"Gino knew that he was going to send the letter in, but wasn't sure about the consequences of doing so. Gino had known about the corruption of the local magistrate for some time, and the connections between the government and the mafia. He had carefully documented everything and was now hoping to expose them all to the world. Gino was sure there would be blow back and they would try to find out who he was, but he couldn't be afraid anymore. A friend of his had disappeared and as he licked and placed the stamp onto the letter, he knew he had to go forward in honor of their memory.",4.75
115,"She just received another letter from her secret admirer, it sure brightens up her day when she receives one of these letters. For each letter she has received, she has written one to her admirer, but she has no where to send them. She has scoured over the envelopes, looking for a clue, the stamp has no unusual markings, the postmark is smudged. she is just at a loss. She is hoping that one day her secret admirer will come forward and she will be able to hand over the letters she wrote to them, but until then all she can do is just enjoy the fact that someone loves her from a far.",4.25
116,"My father was always old fashioned and to this day has never sent an e-mail or a text in his life.  As a child, he showed me how people originally communicated using a letter and a stamp, which today is something of a relic to many.  I have grown to love technology, but I still appreciate what a letter and stamp represent thanks to my father.  Rather than send an e-mail that takes a few seconds, my father is willing to wait days and days to get a response from sending a letter just because that was how he was raised.",3.25
117,"John has recently received a letter from his cousin Joey. Touched at the old school gesture, John decided to write back. He went out and bought some festive stamps for the letter before heading over to the post office. He wanted to send a reply back as soon as he could for his dear cousin was waiting.",2.5
118,"He was going to send it.  He knew he was taking a chance, the letter told the horrible truth of what he had done.  Put the guilt nagged at him and he wanted the release of confessing.  He had finally found a stamp and now there was nothing to stop him putting it in the mail box.",3.25
119,"The little girl woke up and realized that Christmas was only 3 weeks away, which is her favorite day of the year.  She knew she was a good girl but wanted to make sure Santa knew this.  She asked her mother for Santa's address, so she could write a letter to him.  She wrote the letter, put a stamp on the envelope, and asked her mother to send the mail to Santa just in time for Christmas Day.",3
120,"I used to have a pen pal when I was younger. I would sit down once a week and write a letter, put a stamp on the envelop and send the letter off to someone who I didn't know very well. After some time of writing letters back and forth, my pen pal and I became good friends. Now, instead of writing letters, we call each other on the phone and are still friends to this day.",2.5
121,"Rachel lost her last baby tooth. She really wanted some extra money for this tooth. She decided to write a letter to the tooth fairy. It said: Dear Tooth Fairy, I love you! Can I please have 100 dollars? Love Rachel. She asked her mom for a stamp and envelope and asked her to send it to the tooth fairy to her. The next day when she came home from school There was a letter waiting for her. It said Dear Rachel, Hell no! Here is your 1 dollar. PS. Get a damn job.",4.5
122,"It had been so long since we had visited family. I suggested to my son that we mail a letter to his grandma. This would be a fun way for us to spend our afternoon and the family would surely appreciate it too. We sat at the table together and I gave my son some paper and an envelop. When he was done writing, he folder the paper into the envelop and I showed him how to lick the stamp and attach it. He was so eager to drop it in the mailbox to send to his grandma.",2.75
123,"The swan decided to send a letter to his old friend the goose. They used to hang out together and glide for hours side by side on the shiny surface of the lake. But the goose had left for the winter and would not be back for a while. The swan clumsily walked out of the water and retrieved some paper, a pencil, and a stamp he had stashed under a rock for such an occasion. Then he sat on the beach and wrote his letter.",4.5
124,"It was her mother's birthday coming up soon. She decided she rather send a card to her than the usual text message. But not having sent anything through the mail in a while, she had to go buy a stamp in order to send the letter. She had the perfect card chosen out and a heartfelt letter in the card. All left to do was to send it out.",2.25
125,He decided to send a letter to Santa letting Santa know what he wanted for Christmas. He spent a long time getting everything just right. Then he put it in the mail. On Christmas Eve he received the letter back undelivered because he forgot to put a stamp on it.,2.25
126,The young boy wanted to collect box tops to earn a reward from his cereal box. He collected five tops and wrote a letter to send with them. He found a stamp from his mother. He was able to send the stuff and get a fun toy.,3.25
127,"Billy needed to send his mother a birthday card today, because he had forgotten it last week.  He went to the local post office and grabbed a stamp so he could mail the card.  He also decided that he was going to include a nice letter in the card as well, detailing how much he cared for his mother, and how sorry he was that he forgot her birthday.  He had a lot going on the week before, but that was no excuse for forgetting you mom's birthday!  He was going to make up for it!",3
128,"Michael needed to respond to the invitation as soon as possible if he was to be guaranteed a spot, but he did not know how to go about getting it done in secret. He received the letter of acceptance last week and the time was ticking. To send the response was going to be difficult as he did not have access to a car or money to buy a stamp. Michael decided he would have to find someone he could trust that would do it all for him.",3.75
129,"Bruno wanted to send a letter to his grandma in Kentucky. She lived alone and he thought it would be exciting for her to get a letter. After going to the post office to get a stamp, he sent out the letter. He hoped to get a response soon.",2
130,"The little girl placed her stamp on the letter. ""I hope Santa responds this year"", she said with a little hope in her voice. It was time to send the letter. To her surprise, her Mom told her there was a letter addressed to her that arrived the very next day. ""Dear Little Girl: Be sure to leave out some milk and cookies on Christmas Eve, and in exchange your Christmas wish will come true."" Upon reading the reply letter from Santa, shocked, little girl gasped in delight.",3.5
131,"Michael finally made up his mind. He'd run the risk of embarrasment, of outright rejection, by writing the girl whose words had so captivated him two summers ago. He carefully chose each word, especially those surrounding why he was choosing to send a letter after so long, and balancing his yen for restarting a relationship with the desire to to seem so eager. After an hour, he sealed an envelope, and found a stamp in the bottom of a drawer. But then disaster struck -- he had discarded all the envelopes Kayyllee's letters came in, and had not written her address down anywhere!",3.75
132,"Marry was working as a secretary and on everyday at her job she had to get certain papers stamped. Also she had to send letters and emails. She was very organized and her boss was very pleased with her work. He decided that was the right time to promote her, because she did such a great job. She will soon hear the great news about her job.",3.25
